	description	price	prime?	rating	url link
0	Chuwi CoreBook Pro Laptop Ultrabook 13 pollici Win 10 Notebook Portatile Intel Core i3-6157U fino a 2,4 GHz 8 GB RAM 256 GB SSD 2160 * 1440 2K, Type-C 2.4G/5G WiFi	459,00	prime	1,0 su 5 stelle	/CoreBook-Pro-Ultrabook-Notebook-Portatile/dp/B08JPMVKKN?dchild=1
1	Laptop da 14 pollici (Intel Celeron a 64 bit, 4 GB di RAM DDR3, 64 GB di eMMC, batteria da 10000 Mah, webcam HD, sistema operativo Windows 10 preinstallato, display IPS 1366 * 768 FHD) Notebook	254,99	prime	2,3 su 5 stelle	/pollici-batteria-operativo-preinstallato-Notebook/dp/B08BHRW3KB?dchild=1
2	KUU XBOOK Notebook Computer Portatile 14,1 Pollice, PC Portatile da Intel Celeron J4115, Schermo HD 1920 x 1080 IPS, Windows 10 Notebook ultrasottile con cornice stretta(8GB RAM+512GB ROM)	no price available	not prime	3,5 su 5 stelle	No url Available
3	"Acer Aspire 5 A515-54-P1VY Computer portatile Argento 39,6 cm (15.6"") 1920 x 1080 Pixel Intel Pentium Gold 8 GB DDR4 256 GB SSD Wi-Fi 6, Windows 10 Home S , TASTIERA TEDESCA"	562,91	prime	3,0 su 5 stelle	/Acer-A515-54-P1VY-Computer-portatile-TASTIERA/dp/B08C7GKP2P?dchild=1
4	"HP 255 G7 Computer portatile Nero 39,6 cm (15.6"") 1366 x 768 Pixel AMD Athlon Silver 4 GB DDR4-SDRAM 256 GB SSD Wi-Fi 5 (802.11ac) FreeDOS"	439,00	prime	no vote available	/HP-Computer-portatile-DDR4-SDRAM-802-11ac/dp/B08L6F9427?dchild=1
5	"Acer Aspire 1 A114-32-C2A6 Notebook con Processore Intel Celeron N4020, Ram 4 GB DDR4, eMMC 64 GB, Display 14"" HD LED LCD, Scheda Grafica Intel UHD 600, Microsoft 365, Windows 10 Home in S Mode, Nero"	279,00	prime	4,4 su 5 stelle	No url Available
6	"Acer Chromebook 314 CB314-1H-C2W1 Notebook, Pc Portatile con Processore Intel Celeron N4000, Ram 4GB DDR4, eMMC 64 GB, Display 14"" Full HD LED LCD, Scheda Grafica Intel, Chrome OS, Silver, [CB]"	349,00	prime	4,3 su 5 stelle	/Acer-Chromebook-CB314-1H-C2W1-Portatile-Processore/dp/B0855696F5?dchild=1
7	HUAWEI MateBook 13 Laptop, FullView Display 2K da 13 Pollici, AMD Ryzen 5 3500U, 8GB RAM, 512GB SSD, Windows 10 Home, Multi-screen Collaboration, Fingerprint Unlock, Fast Charging, Grigio (Space Grey)	799,00	prime	4,3 su 5 stelle	No url Available
8	"Computer portatile Acer A315-56-3804 nero Intel Core i3-1005G1 8 GB 256 GB SSD Intel HD Graphics 15,6"" FHD Mate WIN10 in modalità S"	526,19	prime	1,5 su 5 stelle	/Computer-portatile-Acer-A315-56-3804-i3-1005G1/dp/B08B4SXCJ1?dchild=1
9	Easy to Learn, Hard to Master - The Fate of Atari	no price available	not prime	4,5 su 5 stelle	No url Available
10	BMAX Y13 Notebook 2 in 1 Touchscreen Convertible Laptop 13.3 pollici 1920x1080 FHD Blacklit Keyboard (Intel Quad Core N4120, 8GB RAM, 256GB SSD, Windows 10 Home) Type C	449,00	not prime	4,1 su 5 stelle	/Y13-Notebook-Convertible-Touchscreen-1920x1080/dp/B07XT5ZSJD?dchild=1
11	"HUAWEI MateBook D 14"" Notebook Portatile, Processore AMD Ryzen 5, 8 GB RAM, 512 GB SSD, Schermo FullView 1080P FHD, Sensore Impronte Digitali, Windows 10 Home, Laptop, Grigio"	no price available	not prime	4,5 su 5 stelle	No url Available
12	"HP - PC Chromebook 14b-ca0000nl Convertibile, Intel Celeron N4000, RAM 4 GB, eMMC 64 GB, Sistema Operativo Chrome OS, Google Play Store, Schermo Touch FHD 14"", Bang&Olufsen, USB-C, Argento [CB]"	449,99	prime	4,2 su 5 stelle	/HP-Chromebook-14b-ca0000nl-Convertibile-Operativo/dp/B088C6BXWZ?dchild=1
13	PC DELL 7010 SFF Intel Core i5 3470 3.20Ghz/RAM 8GB/500GB/DVD+RW/WIN 10 PRO (Ricondizionato)	167,99	not prime	4,3 su 5 stelle	/DELL-Intel-3-20Ghz-500GB-Ricondizionato/dp/B07RK9N3WM?dchild=1
14	"Acer Aspire 3 A315-57G-742A Pc Portatile, Notebook con Processore Intel Core i7-1065G7, Ram 8 GB DDR4, 512 GB PCIe NVMe SSD, Display 15.6"" FHD LED LCD, NVIDIA GeForce MX330 2 GB, Windows 10 Home"	899,00	prime	4,5 su 5 stelle	/Acer-A315-57G-742A-Portatile-Processore-i7-1065G7/dp/B08D6W7ZPY?dchild=1
15	"ASUS Chromebook C423NA-EB0287, Notebook in alluminio con Monitor 14"" FHD Anti-Glare, Intel Celeron N3350, RAM 4GB LPDDR4, 64G eMMC, Sistema operativo Chrome, Argento [CB]"	315,00	not prime	3,8 su 5 stelle	/ASUS-Chromebook-C423NA-EB0287-alluminio-Anti-Glare/dp/B086TLPRXF?dchild=1
16	COMPUTER FISSO INTEL CORE i7 QUAD CORE - RAM 16 GB - SSD 240 - HDD 1TB - SCHEDA VIDEO DEDICATA 2 GB - LICENZA ORIGINALE MICROSOFT WINDOWS 10 PRO - MASTERIZZATORE DVD - PC DESKTOP	479,00	prime	4,3 su 5 stelle	/COMPUTER-FISSO-INTEL-CORE-QUAD/dp/B088FX7Z2V?dchild=1
17	HP - PC ProBook 440 G7 Notebook, Intel Core i5-10210U, RAM 8 GB, SSD 512 GB, NVIDIA GeForce MX250 2 GB, Windows 10 Pro, Schermo Touch 14” FHD IPS, Lettore Impronte Digitali, HDMI, RJ-45, Argento	779,99	prime	4,1 su 5 stelle	/HP-Notebook-i5-10210U-Impronte-Digitali/dp/B08DFDYCSS?dchild=1
18	"HP - PC 14-ds0014nl Stream Notebook, AMD A4-9120e, RAM 4 GB, eMMC 64 GB, Windows 10 Home S, Schermo 14"" HD SVA Antiriflesso, Office 365 Incluso 1 Anno, USB, HDMI, RJ45, Webcam, Nero"	no price available	not prime	3,8 su 5 stelle	No url Available
19	Notebook SSD slim Acer Intel i3 10 th, RAM 12 GB, SSD 512GB m2, display 15.6 Full hd led, Svga Intel HD 600, 3 USB, Wi-Fi, hdmi, BT, Win 10 Pro, Libre Office, Pronto all'Uso, Garanzia Italia	689,77	prime	4,6 su 5 stelle	No url Available
20	Mini PC, 8GB DDR3+256GB SSD Windows 10 Pro Intel Celeron J3455 (fino a 2,3GHz) Quad-Core CPU Mini Computer Desktop con Doppia HDMI @4K HD,2.4G+5G Dual-Band WiFi,Gigabit Ethernet,BT 4.2	249,90	prime	4,4 su 5 stelle	/Windows-Quad-Core-Computer-Dual-Band-Ethernet/dp/B08L6JQD1Y?dchild=1
21	"MSI Modern 14 A10M-1067XIT, Notebook 14"" FHD,Notebook 14"" FHD, Intel Core I7-10510U, 8GB DDR4 2666MHz, 256GB SSD M.2 PCIe, No-OS"	749,00	prime	4,1 su 5 stelle	/MSI-A10M-1067XIT-Notebook-I7-10510U-2666MHz/dp/B08CB1P91L?dchild=1
22	"Lenovo IdeaPad 3 Chromebook Notebook, Display 11.6"" HD, Processore Intel Celeron N4000, 32GB eMMC, 4GB RAM, Chrome OS, Onyx Black"	259,99	prime	3,5 su 5 stelle	/Lenovo-IdeaPad-Chromebook-Notebook-Processore/dp/B08D9R3849?dchild=1
23	Singularity	no price available	not prime	3,8 su 5 stelle	No url Available
24	"ASUS Chromebook C434TA-AI0367, Notebook Convertibile in alluminio con Monitor 14"" FHD Touchscreen Glossy, Intel Core m3-8100Y, RAM 8GB LPDDR3, 128G eMMC, Sistema operativo Chrome, Argento"	699,00	prime	5,0 su 5 stelle	/ASUS-Chromebook-C434TA-AI0367-Convertibile-Touchscreen/dp/B08958MZLD?dchild=1
25	"Notebook Lenovo SSD Cpu AMD A4, Display Hd Led da 15,6"" Ram 8Gb DDR4 , SSD 256GB Nvme, Wifi, Webcam, Bt, 3 usb, versione entry level, Win10 Pro, Pronto All'uso immediato, Garanzia Italia 2 Anni"	no price available	not prime	4,4 su 5 stelle	No url Available
26	Hp 255 G7 Notebook HP Display da 15.6”, CPU AMD A4-9125, Ram 4Gb DDR4 SSD M.2 256 Gb, Radeon R3, Pc portatile HP, HDMI, DVD CD RW, Wi Fi,Bluetooth, Windows 10 Professional	no price available	not prime	4,3 su 5 stelle	No url Available
27	PC DESKTOP COMPUTER FISSO CON LICENZA WINDOWS 10 pro Talloncino con seriale INTEL QUAD CORE RAM 8GB DDR HD1TB DVD/WIFI/HDMI FISSO COMPLETO ASSEMBLATO	249,99	not prime	4,1 su 5 stelle	No url Available
28	2020 NUOVO ARRIVO CHUWI HeroBook Pro 14,1 pollici 1920 * 1080 Schermo IPS Processore Intel N4000 DDR4 8 GB 256 GB SSD Laptop Windows 10(Adesivo tastiera in lingua italiana gratuito)	319,00	not prime	5,0 su 5 stelle	/HeroBook-Processore-tastiera-italiana-gratuito/dp/B087LY7M3B?dchild=1
29	PC Computer Desktop Gaming Entry Level Fujitsu Esprimo P710 Windows 10 Professional Intel Core i5-3470S Memoria Ram 8GB DDR3 Hard Disk 500GB DVD-ROM USB 3.0 GeForce GT710 2GB (Ricondizionato)	199,90	not prime	4,4 su 5 stelle	No url Available
30	"HP - PC Chromebook 14a-na0005nl, Intel Pentium Silver N5000, RAM 4 GB, eMMC 64 GB, Sistema Operativo Chrome OS, Google Play Store, Schermo FHD 14"", Audio Bang&Olufsen, USB-C, Webcam, Argento [CB]"	429,99	prime	5,0 su 5 stelle	/HP-Chromebook-14a-na0005nl-Pentium-Operativo/dp/B087GJY7MK?dchild=1
31	Yizhet Hub USB 3.0 4 Porte Ultrasottile Hub USB con Cavo Esteso da 1M per MacBook Air, Mac PRO/Mini, Windows 10/8.1/8/7/XP, Vista -Trasmissione Dati Alta velocità (5 Gbps)	11,89	not prime	no vote available	/Yizhet-Ultrasottile-MacBook-Trasmissione-velocit%C3%A0/dp/B08KQ2YZBC?dchild=1
32	"Lenovo IdeaPad Flex 5 Notebook Convertibile, Display 14"" Full HD Touch, Processore Intel Core i5-1035G1, 512 GB SSD, RAM 8 GB, Fingerprint, Lenovo Digital Pen, Windows 10, Graphite Grey"	899,99	prime	4,2 su 5 stelle	/Lenovo-Convertibile-Processore-i5-1035G1-Fingerprint/dp/B089NWXD2L?dchild=1
33	"Acer Aspire C24-963 Computer Fisso All in One, PC Desktop con Processore Intel Core i5-1035G1, Ram 8 GB DDR4, SSD 256 GB M.2 PCIE, Display 23.8"" FHD IPS, Intel UHD, Wireless Lan, Windows 10 Home, Nero"	749,00	prime	4,5 su 5 stelle	/Acer-Computer-Processore-i5-1035G1-Wireless/dp/B084XRM5B1?dchild=1
34	AXUF 1080P HD Webcam può Essere piegata in Base allo Spessore del Computer, Copertura per la Privacy con videocamera per Microfono, treppiede, Laptop, Computer, videocamera Plug And Play Desktop	33,99	prime	4,5 su 5 stelle	/AXUF-Copertura-videocamera-Microfono-treppiede/dp/B08MBQY8YG?dchild=1
35	Portatile HP Stream 14-ds0008nf Blu A4-9120e dual 4GB DDR4 64GB eMMC AMD Graphics - UMA 14'' HD slim SVA W10H-MS 1V2L8EA#ABF	309,60	prime	2,8 su 5 stelle	/Portatile-HP-14-ds0008nf-A4-9120e-Graphics/dp/B08D9WSJZN?dchild=1
36	CHUWI CoreBox Mini PC Windows 10 ,Intel Core i5-5257U Mini Desktop pc, 8GB DDR3 256GB SSD,Expandable 2TB 2.5 Pollici HDD, 2.4GHz/5GHz Dual WiFi / 4K Decodifica /BT4.2	299,00	prime	4,2 su 5 stelle	/CHUWI-CoreBox-i5-5257U-Expandable-Decodifica/dp/B08BYFN5BC?dchild=1
37	Virtual Revolution	no price available	not prime	4,0 su 5 stelle	No url Available
38	Notebook 13.3 Pollici TECLAST F6PLUS Pc portatile 360 ° Convertibile Intel Celeron N4100,256 GB SSD, 8 GB RAM, 4K, 1920 x 1080, Windows 10 Grigio	no price available	not prime	3,8 su 5 stelle	No url Available
39	"LENOVO Notebook Essential V145-15AST Monitor 15.6"" HD AMD A4-9125 Ram 4GB SSD 256GB 2xUSB 3.0 Free Dos"	no price available	not prime	4,1 su 5 stelle	No url Available
40	SONGMICS Sedia da Gaming, Sedia da Ufficio Alta, Altezza Regolabile, Braccioli Pieghevoli, Meccanismo di Inclinazione, per Gioco da Computer, Nero OBG28B	87,99	prime	4,5 su 5 stelle	/SONGMICS-Braccioli-Sollevabile-Regolabile-Ergonomica/dp/B017IAKF8Q?dchild=1
41	Doo Webcam 1080P Full HD, doosl Webcam per Laptop, Computer con Clip Regolabile per Videochiamate, Studi, Registrazione e Giochi	23,99	not prime	no vote available	/Doo-Computer-Regolabile-Videochiamate-Registrazione/dp/B08KCDQ18K?dchild=1
42	"Acer Chromebook 514 CB514-1H-P9AS Notebook Portatile, Processore Intel Pentium Quad-Core N4200, Ram 4GB DDR4, eMMC 128 GB, Display 14"" IPS Full HD, Grafica Intel HD 505, Chrome OS, Silver, [CB]"	479,00	prime	4,4 su 5 stelle	/Acer-Chromebook-CB514-1H-P9AS-Portatile-Processore/dp/B0857X4CZ5?dchild=1
43	"Notebook Pc Portatile Lenovo Display Led da 15.6"" / Cpu Amd A4 2.30GHz / Ram 8Gb Ddr4 / Ssd 256gb / Grafica Radeon R3 / Hdmi / Masterizzatore / Wifi / Bluetooth /Web Cam / Open Office / Windows 10 pro"	no price available	not prime	4,0 su 5 stelle	No url Available
44	"Nuovo Apple MacBook Pro (13"", 16GB RAM, 512GB Memoria SSD, Magic Keyboard) - Argento"	2.026,43	prime	4,6 su 5 stelle	/Nuovo-Apple-MacBook-Memoria-Keyboard/dp/B0882T64W8?dchild=1
45	"ASUS Zenbook 14 UX425JA-BM147T, Notebook in alluminio con Monitor 14"" FHD Anti-Glare, Intel Core i5-1035G1, RAM 8GB LPDDR4X, 512GB SSD PCIE, Windows 10 Home, Argento"	829,00	prime	4,5 su 5 stelle	/ASUS-UX425JA-BM147T-alluminio-Anti-Glare-i5-1035G1/dp/B086VPWHZ1?dchild=1
46	"Acer Swift 1 SF114-32-P4X8 Argento Computer Portatile 35,6 cm (14"") 1920 x 1080 Pixel Intel® Pentium® Silver 4 GB DDR4-SDRAM 256 GB SSD Windows 10 Home Swift 1 Swift 1 SF114-32-P4X8 N5000"	669,16	prime	5,0 su 5 stelle	/Acer-SF114-32-P4X8-Computer-Portatile-DDR4-SDRAM/dp/B07W67C5WS?dchild=1
47	"Acer Nitro 5 AN515-54-72FF Notebook Gaming, Processore Intel Core i7-9750H, RAM 16 GB DDR4, 1024GB PCIe NVMe SSD, Display 15.6"" FHD IPS 60 Hz LCD, Nvidia GeForce GTX 1650 4GB GDDR5, Windows 10 Home"	1.299,00	prime	4,4 su 5 stelle	/Acer-AN515-54-72FF-Notebook-Processore-i7-9750H/dp/B084XLGBKV?dchild=1
0	"HP 250 G7 Notebook PC Computer portatile Nero 39,6 cm (15.6"") 1366 x 768 Pixel Intel® Core™ i3 di decima generazione 8 GB DDR4-SDRAM 256 GB SSD Wi-Fi 4 (802.11n) Win10Pro"	no price available	not prime	5,0 su 5 stelle	No url Available
1	HP - PC Pavilion x360 14-dw0003nl Convertibile, Intel Core i3-1005G1, RAM 8 GB, SSD 256 GB, Grafica Intel UHD, Windows 10 Home, Schermo Touch 14” FHD IPS, Lettore Impronte Digitali, USB-C, Argento	699,99	not prime	5,0 su 5 stelle	/HP-Pavilion-14-dw0003nl-Convertibile-i3-1005G1/dp/B08BKT9YC2?dchild=1
2	"Apple MacBook PRO Grigio Computer Portatile 40,6 cm (16"") 3072 x 1920 Pixel 9th Gen Intel® Core i7 16 GB DDR4-SDRAM 512 GB SSD macOS Catalina MacBook PRO, 9th Gen Intel® Core i7, 2,6"	no price available	not prime	4,7 su 5 stelle	No url Available
3	"HP - Gaming Pavilion 16-a0019nl Notebook, Intel Core i7-10750H, RAM 16 GB, SSD 512 GB, NVIDIA GeForce GTX 1650Ti 4 GB, Windows 10 Home, Schermo 16.1"" FHD IPS, Webcam, USB-C, HDMI, RJ-45, Nero"	1.299,99	prime	5,0 su 5 stelle	/HP-Pavilion-16-a0019nl-Notebook-i7-10750H/dp/B08BKV4VVW?dchild=1
4	"ASUS M509DA-EJ025T Argento Computer portatile 39,6 cm (15.6"") AMD Ryzen 5 8 GB DDR4-SDRAM 512 GB SSD Windows 10"	no price available	not prime	4,3 su 5 stelle	No url Available
5	"ASUS P509JA-EJ025R Grigio Computer portatile 39,6 cm (15.6"") 1920 x 1080 Pixel Intel® Core? i3 di decima generazione 4 GB 256 GB SSD Wi-Fi 5 (802.11ac) Windows 10 Pro"	no price available	not prime	no vote available	No url Available
6	Tablet PC 7 Pollici,Computer portatile Quad Core Con Tastiera e Penna, Tableta memoria RAM da 512MB + 8GB,Fotocamera integrata Dual Camera,WIFI,Bluetooth (Rosa)	66,99	prime	2,9 su 5 stelle	/Computer-portatile-Fotocamera-integrata-Bluetooth/dp/B07T96DWZ9?dchild=1
7	Dark/Web	no price available	not prime	no vote available	No url Available
8	"ASUS Chromebook C223NA-GJ0067, Notebook con Monitor 11.6"" HD Anti-Glare, Intel Celeron N3350, RAM 4GB LPDDR4, 32G eMMC, Sistema operativo Chrome, Grigio"	269,00	prime	1,0 su 5 stelle	/ASUS-Chromebook-C223NA-GJ0067-Anti-Glare-operativo/dp/B0895CRMC6?dchild=1
9	Megaport PC-Gaming Intel Core i7-10700F 8x 2.90GHz • GeForce RTX 2060 6GB • 16 GB DDR4 • 480GB SSD • 1TB HDD • Windows 10 Home • WiFi • PC da gaming • PC assemblato	1.199,00	not prime	4,4 su 5 stelle	/Megaport-PC-Gaming-i7-8700-assemblato-completo/dp/B079G2RQVB?dchild=1
10	"Apple MacBook Air Argento Computer Portatile 33,8 cm (13.3"") 2560 x 1600 Pixel Intel® Core i3 di Decima Generazione 8 GB LPDDR4x-SDRAM 256 GB SSD Wi-Fi 5 (802.11ac) macOS Catalina MacBook"	no price available	not prime	4,8 su 5 stelle	No url Available
11	"Acer Aspire 3 A315-56-5205 - Computer portatile 15,6"" FHD (Core i5, 8 GB di RAM, SSD 512 GB, Intel UHD Graphics, Windows 10F)"	742,27	prime	3,6 su 5 stelle	/Acer-Aspire-A315-56-5205-Computer-portatile/dp/B089T436YR?dchild=1
12	"HONOR MagicBook 14 Notebook, 14"" FullHD(AMD Ryzen 5-3500U, 8GB RAM, 256GB PCIe SSD, 1920*1080, Windows 10, Multischermo Collaborazione, USB 3.0), Spazio Grigio (Tastiera QWERTY Inglese)"	605,99	prime	3,9 su 5 stelle	/HONOR-MagicBook-Notebook-Multischermo-Collaborazione/dp/B08GLJ6667?dchild=1
13	"ASUS ROG Strix G15 G512LI-HN113T, Notebook Monitor 15,6"" FHD Anti-Glare 144Hz, Intel Core i7-10750H, RAM 16GB DDR4, Grafica NVIDIA GeForce GTX1650 Ti 4GB, 512GB SSD PCIE, Windows10 Home, Nero scuro"	1.199,00	prime	4,3 su 5 stelle	/ASUS-G512LI-HN113T-Anti-Glare-i7-10750H-Windows10/dp/B086VR1G9F?dchild=1
14	"Acer Nitro 5 AN515-44-R6WC Notebook Gaming con Processore AMD Ryzen 7 4800H, Ram 8 GB DDR4, 512 GB PCIe NVMe SSD, Display 15.6"" FHD IPS LED LCD, NVIDIA GeForce GTX 1650 4 GB, Windows 10 Home"	1.099,00	prime	4,5 su 5 stelle	/Acer-AN515-44-R6WC-Notebook-Processore-Display/dp/B087D42TS5?dchild=1
15	Apple MacBook Pro MD101LL/A - Computer portatile da 13,3inch (2,5 Ghz, 4 GB RAM, 500 GB HD)(Ricondizionato)	no price available	not prime	3,8 su 5 stelle	No url Available
16	PC Computer Desktop Fujitsu Esprimo E720, Windows 10 Professional, Intel Core i5-4570, Memoria Ram 8GB DDR3, SSD 480GB, DVD-ROM, WIFI (Ricondizionato)	198,99	not prime	5,0 su 5 stelle	/Computer-Desktop-Fujitsu-Professional-Ricondizionato/dp/B08KXYQSWH?dchild=1
17	"Lenovo AIO 3 IdeaCentre All in One 3, Display 21.5"" Full HD, Processore AMD Athlon Silver 3050U, 256 GB SSD, RAM 8 GB, DVD±RW, Windows 10, Tastiera e Mouse USB, Business Black"	499,00	prime	4,1 su 5 stelle	/Lenovo-AIO-IdeaCentre-Processore-Tastiera/dp/B089MCMX97?dchild=1
18	HP – PC 15s-eq0021nl Notebook, AMD Ryzen 3, RAM 8 GB, SSD 256 GB, Grafica AMD Radeon Vega 3, Windows 10 Home S, Schermo 15” FHD SVA Antiriflesso, Micro-Edge, Fast Charge, Lettore SD/Micro SD, Argento	no price available	not prime	4,4 su 5 stelle	No url Available
19	"Acer Aspire 3 A315-42 Computer Portatile Nero 39,6 cm (15.6"") 1920 x 1080 Pixel AMD Athlon II 4 GB DDR4-SDRAM 128 GB SSD Wi-Fi 5 (802.11ac) Windows 10 Home Aspire 3 A315-42, AMD Athlon II, 2,4"	323,36	not prime	1,0 su 5 stelle	/Acer-Computer-Portatile-DDR4-SDRAM-802-11ac/dp/B087XD9RXK?dchild=1
20	"Notebook HP 250 G7 Silver Portatile Display da 15.6"" /Cpu Intel core I3-1005G1 3,4Ghz /Ram 8Gb DDR4 /SSD M2 512GB /VGA INTEL UHD /Hdmi DVD Wifi Bluetooth/Windows 10 professional + Open Office"	no price available	not prime	4,3 su 5 stelle	No url Available
21	Megaport PC Completo AMD Athlon 3000G 2x 3.50GHz • AMD Radeon Vega 3 • Schermo ASUS Full-HD LED 24” • Tastiera/Mouse • Windows 10 Home • 1TB HDD • 8GB RAM DDR4 2400	529,00	not prime	4,1 su 5 stelle	/Megaport-Completo-A8-9600-Tastiera-completo/dp/B01K7YAMEC?dchild=1
22	Thomson HERO9A-1BK32 - Computer portatile 2 in 1 Nero 9	130,44	prime	3,3 su 5 stelle	/Thomson-COMPUTER-PORTATILE-quad-core-Graphics/dp/B07235SJ82?dchild=1
23	Automan	no price available	not prime	no vote available	No url Available
24	"Apple MacBook PRO Grigio Computer Portatile 40,6 cm (16"") 3072 x 1920 Pixel 9th Gen Intel® Core i9 16 GB DDR4-SDRAM 1024 GB SSD macOS Catalina MacBook PRO, 9th Gen Intel® Core i9, 2,3"	no price available	not prime	4,6 su 5 stelle	No url Available
25	"SAMSUNG Galaxy Book Ion NP950XCJ-X01DE Notebook/Portatile Computer Portatile Argento 39,6 cm (15.6"") 1920 x 1080 Pixel Intel® Core i7 di Decima Generazione 16 GB DDR4-SDRAM 512 GB SSD Wi-Fi 6 ("	2.015,89	prime	3,3 su 5 stelle	/SAMSUNG-NP950XCJ-X01DE-Portatile-Generazione-DDR4-SDRAM/dp/B0892QX5DG?dchild=1
26	Mini PC, Intel Pentium J3710 Processore Quad-Core CPU 4 GB DDR / 128 GB SSD Mini Desktop Computer con Windows 10, HDMI e VGA, Dual Band WiFi 2,4 + 5,8 G, BT 4.2, USB 3.0	189,99	prime	4,7 su 5 stelle	/Pentium-Processore-Quad-Core-Desktop-Computer/dp/B08H816MBC?dchild=1
27	VESSTT Webcam per PC, Full HD 1080P Videocamera con Microfono PC Laptop Desktop Computer USB 2.0 Full HD Videocamera con Clip Regolabile per Videochiamata, Studi, Conferenze, Registrazione e Giochi	29,99	prime	4,6 su 5 stelle	/VESSTT-Videocamera-Regolabile-Videochiamata-Registrazione/dp/B08K3FHDMD?dchild=1
28	"Nuovo Apple MacBook Pro (16"", 16GB RAM, Archiviazione 1TB, Intel Core i9 a 2,3GHz) - Grigio Siderale"	3.028,00	prime	4,6 su 5 stelle	/Nuovo-Apple-MacBook-Archiviazione-Intel/dp/B081G26RWP?dchild=1
29	The Commodore Wars - 8-Bit Generation	no price available	not prime	no vote available	No url Available
30	"Lenovo Chromebook S345 Notebook, Display 14"" Full HD TN, Processore AMD A6-9220C, 64 GB eMMC, RAM 4 GB, Chrome OS, Mineral Grey"	329,00	prime	no vote available	/Lenovo-Chromebook-Notebook-Processore-A6-9220C/dp/B08J8C1TD2?dchild=1
31	"Apple MacBook PRO Argento Computer Portatile 33,8 cm (13.3"") 2560 x 1600 Pixel Intel® Core i5 di ottava Generazione 8 GB LPDDR3-SDRAM 256 GB SSD Wi-Fi 5 (802.11ac) macOS Catalina MacBook"	no price available	not prime	4,7 su 5 stelle	No url Available
32	HAPAW Supporto PC Portatile, 8-Levels Regolabile Supporto Laptop Notebook Pieghevole Alluminio Porta Tablet PC Supporto Compatibile con MacBook Air/PRO, dell, XPS, HP, Lenovo, iPad, Cellulare (5”–18”)	19,98	not prime	4,4 su 5 stelle	/HAPAW-Portatile-Regolabile-Pieghevole-Compatibile/dp/B08C57S29M?dchild=1
33	PC DELL 7010 SFF Intel Core i5 3470 3.20Ghz/RAM 8GB/480GB SSD/DVD+RW/WIN 10 PRO (Ricondizionato)	209,57	not prime	4,5 su 5 stelle	/DELL-Intel-3-20Ghz-480GB-Ricondizionato/dp/B07RR23WR2?dchild=1
34	"Lenovo ThinkBook 15 Grigio Computer Portatile 39,6 cm (15.6"") 1920 x 1080 Pixel Intel® Core i7 di Decima Generazione 16 GB DDR4-SDRAM 512 GB SSD Wi-Fi 6 (802.11ax) ThinkBook 15, Intel®"	1.084,61	prime	2,7 su 5 stelle	/Lenovo-ThinkBook-Portatile-Generazione-DDR4-SDRAM/dp/B08656628P?dchild=1
35	"Acer Swift 3 SF314-58-597S Pc Portatile, Notebook con Processore Intel Core i5-10210U, 8 GB DDR4, 512 GB PCIe NVMe SSD, Display 14"" FHD IPS LED LCD, Scheda Grafica Intel UHD, Windows 10 Home, Silver"	749,00	prime	4,2 su 5 stelle	/Acer-SF314-58-597S-Portatile-Processore-i5-10210U/dp/B084XLQDBS?dchild=1
36	Notebook Lenovo Silver 8 Gb DDR4, SSD M.2 PCi da 256Gb cpu Amd A4 3020 di ultima generazione, Display Hd da 15,6 pollici, web cam, 3usb, hdmi, bt, Win10 Pro, Pronto All'uso, garanzia Italia	no price available	not prime	4,3 su 5 stelle	No url Available
37	"Apple MacBook Air Oro Computer Portatile 33,8 cm (13.3"") 2560 x 1600 Pixel Intel® Core i3 di Decima Generazione 8 GB LPDDR4x-SDRAM 256 GB SSD Wi-Fi 5 (802.11ac) macOS Catalina MacBook Air,"	no price available	not prime	4,8 su 5 stelle	No url Available
38	"ASUS VivoBook S15 S533FA-BQ008T Computer Portatile 39,6 cm (15.6"") 1920 x 1080 Pixel Intel Core i5 di Decima Generazione 8 GB DDR4-SDRAM 512 GB SSD Wi-Fi 6 (802.11ax) Windows 10, Tastiera Tedesca"	852,07	prime	2,5 su 5 stelle	/ASUS-S533FA-BQ008T-Portatile-Generazione-DDR4-SDRAM/dp/B083SWY6CV?dchild=1
39	"Acer Nitro 5 AN515-54-55CQ Notebook Gaming, Intel Core i5-9300H, Ram 8 GB, 512 GB PCIe NVMe SSD, Display 15.6"" FHD IPS 60 Hz LCD, Nvidia GeForce GTX 1650 4 GB GDDR5, No Sistema Operativo"	899,00	prime	3,2 su 5 stelle	/Acer-AN515-54-55CQ-Notebook-i5-9300H-Operativo/dp/B084XLFCX3?dchild=1
40	"HP - PC 15s-eq1015nl Notebook, AMD Ryzen 3, RAM 8 GB, SSD 128 GB, Grafica AMD Radeon R3, Windows 10 Home S Mode, Schermo 15.6"" FHD SVA Antiriflesso, Lettore Micro SD, HDMI, USB-C, Webcam, Grigio"	499,99	prime	4,4 su 5 stelle	/HP-15s-eq1015nl-Notebook-Grafica-Antiriflesso/dp/B089QX6XDD?dchild=1
41	AWOW - Computer portatile con touchscreen da 13,3 pollici, 1920 x 1080 FHD touchscreen, Windows 10 Pro, 8 GB DDR4, 512 G SSD, IPX5, impermeabile, colore: Argento, Tastiera Americana	439,99	prime	5,0 su 5 stelle	/AWOW-portatile-touchscreen-impermeabile-Americana/dp/B08B1BH458?dchild=1
42	Beelink BT3 Pro II Mini PC Support Windows 10, Intel Atom x5-Z8350 Processor 4GB Ram 64GB Rom Graphics HD 400, 1000Mbps LAN MINI Computer con 5.8G+2.4G WiFi HDMI+VGA Outputs/Bluetooth 4.0/USB 3.0	149,99	prime	4,3 su 5 stelle	/SeeKool-x5-Z8350-Processor-Graphics-Bluetooth/dp/B07CQGRZKF?dchild=1
43	HP 255 G7 senza Sistema Operativo (FreeDOS)	no price available	not prime	4,2 su 5 stelle	No url Available
44	BIGMAC Computer portatile da 10 pollici Android 6.0 Quad core laptop mini netbook 8GB WIFI webcam Netflix YouTube google Flash ultra-sottile (Argento)	149,00	not prime	3,6 su 5 stelle	/BIGMAC-Computer-portatile-pollici-ultra-sottile/dp/B087R2121J?dchild=1
45	HP - PC 15-dw1016nl Notebook, Intel Core i7-10510U, RAM 8 GB, SSD 256 GB, NVIDIA GeForce MX130 2 GB, Windows 10 Home, HP Fast Charge, Lettore Micro SD, USB-C, HDMI, Webcam, RJ-45, Argento	899,99	prime	4,4 su 5 stelle	/HP-15-dw1016nl-Notebook-i7-10510U-GeForce/dp/B08BKTWDQQ?dchild=1
46	Mini PC,Intel Celeron J4125,8GB RAM+120GB ROM,Windows 10 Pro(64-bit),Supporto 2.5'' SATA SSD/HDD,Dual WiFi 2.4/5G, Bluetooth 4.2,4K HD,2 HDMI+1 VGA +USB 3.0 Porta AK3 Mini Computer Desktop	239,90	prime	3,7 su 5 stelle	/Celeron-Windows-Supporto-Bluetooth-Computer/dp/B089T4B234?dchild=1
47	"HP 255 G7 Notebook portatile, SSD M2 da 512GB, Display da 15.6"", Amd A6 3050U fino a 3,2 GHz, 8GB di RAM DDR4, Libre Office, Wi-fi, Dvd-Cd Rw, 3 usb, web cam, Win10 Pro, Pronto All'uso, Gar. Italia"	no price available	not prime	4,1 su 5 stelle	No url Available
0	Lenovo, Mini PC, Desktop Computer, ThinkCentre M93p USDT Tiny Intel Core i5 240GB SSD (NEU) Hard Disk 8GB memoria Win 10 Pro W-LAN 10AAA0PQ00 (ricondizionato)	232,00	not prime	4,3 su 5 stelle	/Lenovo-ThinkCentre-SSD-10AAA0PQ00-certificato/dp/B07L9T18SW?dchild=1
1	You Are Wanted - Season 2	no price available	not prime	no vote available	No url Available
2	"Acer Swift 3 SF314-42-R4XJ Computer Portatile Argento 35,6 cm (14"") 1920 x 1080 Pixel AMD Ryzen 7 8 GB LPDDR4-SDRAM 1000 GB SSD Wi-Fi 6 (802.11ax) Windows 10 Home Swift 3 SF314-42-R4XJ, AMD"	no price available	not prime	2,5 su 5 stelle	No url Available
3	"HP EliteBook 830 G5 1.60GHz i5-8250U Intel® Core™ i5 di ottava generazione 13.3"" 1920 x 1080Pixel Argento Computer portatile"	1.247,50	not prime	no vote available	/HP-EliteBook-generazione-1080Pixel-portatile/dp/B07C7YSXCC?dchild=1
4	KKshop Cuffie 3.5mm per Computer con Microfono, Cuffie Rumore Business Cancellare, Cuffie per PC Cellulare, Perfetto per Skype, Seminario Web, Chiamare, Call Center	19,59	not prime	4,8 su 5 stelle	/KKshop-Microfono-Cancellare-Cellulare-Seminario/dp/B08JPN89X4?dchild=1
5	"HP-PC Pavilion 14-ce3034nl Notebook, Intel Core i5-1035G1, RAM 8 GB, SSD 512 GB, Grafica UHD Intel, Windows 10 Home, Schermo 14"" FHD Antiriflesso, Lettore Impronte Digitali, Lettore Micro SD, Argento"	no price available	not prime	4,3 su 5 stelle	No url Available
6	PRIXTON Netbook PC11 Pro - Laptop portatile / Notebook Computer portatili con schermo da 11,6 pollici, Windows 10 Pro, processore Intel, 3GB RAM / 32GB / 512GB SSD, tastiera QWERTY spagnola	no price available	not prime	3,0 su 5 stelle	No url Available
