	description	price	prime?	rating	url link
13	FANCY CHERRY® NUOVO 2017 HD 10 inch Mini Laptop Notebook Netbook Tablet Computer 1G DDR3 4GB di memoria VIA WM8880 CPU Dual Core Android Schermo Wifi Camera Keyboard USB HDMI (Netbook 8G-bianca)	116,00	not prime	3,1 su 5 stelle	/FANCY-Notebook-Computer-Keyboard-8G-bianca/dp/B0711K9GH7?dchild=1
14	PC Computer Desktop Gaming Entry Level Fujitsu Esprimo P720, Windows 10 Professional, Intel Core i5-4570S, Memoria Ram 8GB DDR3, HDD 500GB, DVD-ROM, Radeon RX 550 4GB (Ricondizionato)	269,90	not prime	no vote available	/Computer-Desktop-Professional-i5-4570S-Ricondizionato/dp/B08JZHRPMB?dchild=1
15	CeO-Tech Alpha V4 PC Fisso - CPU INTEL G5420 3.80GHz 4MB Cache | RAM 16GB DDR4 | SSD 500GB | Radeon RX Vega 3 | Ultra HD 4K | Masterizzatore CD/DVD | WI-FI | Windows 10 PRO	449,00	not prime	4,5 su 5 stelle	/CeO-Alpha-Desktop-CPU-J4105-4x2-50GHz-MULTIMEDIALE/dp/B07JMQDSH3?dchild=1
16	PC Computer Desktop HP Compaq 6200, Windows 10 Professional, Intel Core i3-2100, Memoria Ram 4GB DDR3, Hard Disk 250GB, DVD-ROM (Ricondizionato)	85,65	not prime	3,7 su 5 stelle	/Computer-Desktop-HP-Professional-Ricondizionato/dp/B08BBXJ6QC?dchild=1
17	"LENOVO Essential V145 Notebook 15,6"" HD (1366x768) Ram 8GB, SSD 256GB, CPU AMD A4, Radeon R3, WIFI Bluetooth Webcam Win 10 Integrato (256GB SSD)"	no price available	not prime	3,9 su 5 stelle	No url Available
18	"HP OMEN 17-cb1085ng Computer Portatile Nero 43,9 cm (17.3"") 1920 x 1080 Pixel Intel® Core i7 di Decima Generazione 16 GB DDR4-SDRAM 1512 GB HDD+SSD NVIDIA GeForce RTX 2080 Super Wi-Fi 6 (802.11ax)"	3.024,61	prime	4,6 su 5 stelle	/HP-17-cb1085ng-Portatile-Generazione-DDR4-SDRAM/dp/B0895G8FF1?dchild=1
19	Webcam, Webcam per PC fisso, Telecamera per PC Con Microfono Full HD 1080P,Webcam er Computer USB per Videochiamate	23,99	not prime	4,4 su 5 stelle	/Webcam-Telecamera-Microfono-Computer-Videochiamate/dp/B088TM1JFV?dchild=1
20	AmazonBasics - Altoparlanti per computer desktop o PC portatile, alimentazione CA (versione europea)	20,54	not prime	4,4 su 5 stelle	/AmazonBasics-Computer-Speakers-Desktop-AC-Powered/dp/B07D924NF5?dchild=1
21	"Microsoft Surface Laptop 3, 15"", AMD Ryzen 5 3580U, RAM 8 GB, SSD 256 GB, Nero"	1.699,00	prime	4,4 su 5 stelle	/Microsoft-Surface-Laptop-Ryzen-3580U/dp/B07XVTMS3N?dchild=1
22	KLIM Cyclone - Base di Raffreddamento PC Portatile + Laptop Stand con 5 ventole + Il Miglior Supporto Raffreddatore + Cooling Pad Gaming PS4 Xbox One + Bianca + Nuova Versione 2020	36,97	prime	4,4 su 5 stelle	/KLIM-Cyclone-Raffreddamento-Portatile-Raffreddatore/dp/B08BKJRXY2?dchild=1
23	Samsung C27F396 Monitor Curvo per PC, 27'' Full HD, 1920 x 1080, 60 Hz, 4 ms, Freesync, D-sub, HDMI, Nero	134,00	prime	4,6 su 5 stelle	/Samsung-C27F396-Monitor-Desktop-Freesync/dp/B01BCF09R0?dchild=1
24	LABISTS Monitor Portatile 13.3 Pollici, Monitor IPS con Risoluzione 1920 x 1080, Supporta HDMI e USB-C, 16:9 HDR, Adatta a Switch, Laptop, Cellulare, Raspberry Pi, PS3/PS4/XBOX, con Supporto e Cover	178,99	prime	4,6 su 5 stelle	/LABISTS-Monitor-Portatile-Risoluzione-Supporta/dp/B089GNJD9S?dchild=1
25	"MSI All in One PRO 16 Flex 8GL-012XEU, Schermo Touch HD 15.6"", CPU Pentium N5000, SSD M.2 128GB, RAM 4GB, Intel UHD Graphics, Porta RJ45 a COM, Freedos, VESA 100x100"	503,73	not prime	no vote available	/Flex-N5000-128GB-Touch-FREEDOS/dp/B07WTHXPGC?dchild=1
26	NOTEBOOK RICONDIZIONATO ULTRASLIM HP FOLIO 9470M INTEL CORE I5 3427U 1.80GHZ/8GB/SSD 240GB/WEB/WIN 10 PRO (Ricondizionato) )	429,99	not prime	3,6 su 5 stelle	/NOTEBOOK-RICONDIZIONATO-ULTRASLIM-HP-Ricondizionato/dp/B07JM8P2FY?dchild=1
27	Zaino Antifurto Zaino Per PC Portatile,Zaino per Laptop,Zaino Porta PC Impermeabile,Zaino per Computer Portatile 15.6 Pollici, Zaino Uomo con Caricatore USB,Zaino Lavoro Uomo per Scuola Viaggio,Nero	21,56	not prime	4,6 su 5 stelle	/Antifurto-Portatile-Impermeabile-Computer-Caricatore/dp/B07FDLS3NH?dchild=1
28	PC RICONDIZIONATO LENOVO M92P TINY INTEL CORE I5 3470T 2,90 GHZ/8GB/240GB SSD/WIN 10 PRO (Ricondizionato)	219,00	prime	4,3 su 5 stelle	/RICONDIZIONATO-LENOVO-INTEL-3470T-Ricondizionato/dp/B07Q3XJ8MW?dchild=1
29	Hanna - Season 1	no price available	not prime	no vote available	No url Available
30	"HP - Gaming OMEN 15-dh1002nl Notebook, Intel Core i7-10750H, RAM 16 GB, SSD 512 GB, NVIDIA GeForce RTX 2070 8 GB, Windows 10 Home, Schermo 15.6"" FHD IPS 144 Hz, Bang&Olufsen, USB-C, HDMI, RJ-45, Nero"	1.899,00	prime	4,5 su 5 stelle	/HP-15-dh1002nl-Notebook-i7-10750H-GeForce/dp/B08BKSM5MM?dchild=1
31	"DELL Ultrabook XPS 15 7590 Monitor 15,6"" Full HD Intel Core i7-9750H Ram 16 GB SSD 512 GB Nvidia GeForce GTX 1650 4 GB 2xUSB 3.0 Windows 10 Pro"	1.999,00	prime	3,8 su 5 stelle	/Dell-Technologies-XPS-15-7590/dp/B07ZQ98SLW?dchild=1
32	ALLDOCUBE KBook Lite Laptop, notebook da 13,5 pollici, schermo IPS 3000x2000, Intel Apollo Lake N3350 CPU, 4GB RAM 128GB SSD, Windows 10, connettore Tipe C, USB 3.0	269,99	not prime	3,2 su 5 stelle	/ALLDOCUBE-notebook-pollici-m3-6Y30-Ultrabook/dp/B07XJ3X7DC?dchild=1
33	"DELL Latitude 7480 2.8GHz i7-7600U Intel® Core™ i7 di settima generazione 14"" 1920 x 1080Pixel Nero Computer portatile"	no price available	not prime	no vote available	No url Available
34	"DELL Inspiron 5590 Notebook 15,6"" Display FHD 1920 x 1080 Pixels , Intel i5 10° GEN. 4 core , Ram 8 GB , SSD 256 GB , UHD Graphics 2xUSB 3.0 , Windows 10 Pro"	855,00	prime	no vote available	/Inspiron-Notebook-Display-Graphics-Windows/dp/B08LC8SGDF?dchild=1
35	Trust Primo Borsa Trasporto per Laptop da 16 Pollici, Nero	11,99	not prime	4,6 su 5 stelle	/Trust-Primo-Trasporto-Laptop-Pollici/dp/B01JPF5028?dchild=1
36	BMAX X15 Notebook Pc Portatile 15.6 Pollici Intel Gemini Lake N4100 (fino a 2,4 GHz) 8GB RAM + 128GB SSD Windows 10 Laptop Wifi, USB3.0, Wifi, BT 4.2, Telecamera	no price available	not prime	4,3 su 5 stelle	No url Available
37	CeO-Tech Zeta V2 PC Gaming - Ryzen 3 3100 (Zen2) 4 Core 3.90 | RAM 16GB DDR4 | SSD 240GB | GTX 1050TI 4GB | Ultra HD 4K | Wi-Fi | WIN10 PRO *NUOVA COMPOSIZIONE	615,00	not prime	4,6 su 5 stelle	/CeO-Zeta-V2-Gaming-3-20GHz/dp/B07KVGMTG4?dchild=1
38	MODKON Webcam, 1080P HD PC Webcam con Microfono e Cover per Computer Desktop Laptop, Web Camera USB Plug And Play per Youtube Studio Online Chiamata, Videochiamate Conferenza.	22,99	not prime	3,9 su 5 stelle	/MODKON-Microfono-Computer-Videochiamate-Conferenza/dp/B08GQW1598?dchild=1
39	Fujitsu Lifebook T902 - Intel Core i5-3320, 8 GB, 120 GB, SSD, Windows 10 Home, QWERTZ (tastiera tedesca), 13.3 pollice (Ricondizionato)	299,95	prime	3,8 su 5 stelle	/Fujitsu-Lifebook-T902-tastiera-Ricondizionato/dp/B086XJ711S?dchild=1
40	DILC Airo W Pc Desktop Intel Quad Core 2.00 ghz Ram 8 gb Ssd 480 gb WiFi Masterizzatore Licenza Windows 10 PRO	239,90	prime	4,0 su 5 stelle	/COMPUTER-FISSO%E2%96%ACLICENZA-PRO%E2%96%ACASSEMBLATO-QUAD-CORE-1TB%E2%96%ACWIFI%E2%96%ACMASTERIZZATORE%E2%96%ACDILC/dp/B07G4DZ7N6?dchild=1
41	"MSI Gaming GT62VR 7RE(Dominator Pro)-224DE 2.8GHz i7-7700HQ 15.6"" 1920 x 1080Pixel Nero Computer portatile"	427,00	not prime	no vote available	/MSI-Dominator-i7-7700HQ-1080Pixel-portatile/dp/B01N6N3BYC?dchild=1
42	"MacBook 12"" (Intel Core i5 dual-core a 1,3GHz, 512GB) - Oro rosa"	1.510,37	prime	4,2 su 5 stelle	/Apple-MNYN2T-A-Macbook-Intel/dp/B072VSP17K?dchild=1
43	"MSI GP75 Leopard 10SEK-050IT, Notebook Gaming 17,3"" FHD IPS-Level 144Hz, Intel Core I7-10750H, 16GB RAM DDR4, 1TB SSD M.2 PCIE, Nvidia RTX 2060, 6GB GDDR6 [Layout Italiano]"	1.849,00	prime	4,4 su 5 stelle	/MSI-10SEK-050IT-Notebook-IPS-Level-I7-10750H/dp/B086QFJ31Z?dchild=1
44	TMEZON 1080P Full HD Webcam per PC con Microfono Riduzione del Rumore,Messa a Fuoco Automatica,Design Piegato e spostato,Videocamera USB per Skype Conferenza,Videochiamate e Lavoro a Casa	20,99	not prime	4,0 su 5 stelle	/TMEZON-Automatica-Videocamera-Conferenza-Videochiamate/dp/B088FKD6H8?dchild=1
45	HP – PC Envy 13-ba0006nl Notebook, Intel Core i5-1035G1, RAM 8 GB, SSD 512 GB, Grafica Intel UHD, Windows 10 Home, Schermo 13.3” FHD, Lettore impronte digitali, Lettore Micro SD, USB-C, HDMI, Argento	849,99	prime	3,7 su 5 stelle	/HP-13-ba0006nl-Notebook-i5-1035G1-impronte/dp/B086LWC8R9?dchild=1
46	"Notebook Pc Portatile HP 255 G7 Display 15.6"" /Cpu Amd A4 da 2,3ghz A 2,6GHz /Ram 8Gb ddr4 /SSD M2 512GB /Vga Radeon R3 / Hdmi / Masterizzatore Wifi Bluetooth /Licenza Windows 10 pro + Open Office"	no price available	not prime	4,2 su 5 stelle	No url Available
47	Computer HP Elite 8100 i5-650 Ram 8GB HDD 250GB DVD-ROM Windows 10 Pro (Ricondizionato)	119,90	not prime	no vote available	/Computer-HP-DVD-ROM-Windows-Ricondizionato/dp/B08HVGJYV9?dchild=1
